{
  "name": "shadow_tier2_directional",
  "display_name": "Shadow Tier 2: Directional Screening",
  "emoji": "🧭",
  "description": "CEQR Tier 2 directional screen. Eliminates sensitive resources in the triangular no-shadow zone south of the building (\u00b1108\u00b0 from true north). Remaining sites proceed to Tier 3.",
  "category": "shadows",
  "jurisdiction": ["NYC", "generic"],
  "inputs": {
    "building_geojson": {
      "type": "geojson",
      "description": "Building footprint geometry in GeoJSON format",
      "optional": false
    },
    "building_height_ft": {
      "type": "number",
      "description": "Building height in feet",
      "optional": false
    },
    "jurisdiction": {
      "type": "enum",
      "enum": ["NYC", "generic"],
      "description": "Jurisdiction for analysis. NYC uses CEQR \u00b1108\u00b0 threshold.",
      "optional": false
    },
    "sensitive_sites": {
      "type": "geojson",
      "description": "Sensitive sites GeoJSON. If omitted, uses default NYC Parks dataset.",
      "optional": true
    }
  },
  "outputs": {
    "sites_requiring_tier3": {
      "type": "geojson",
      "description": "Sensitive sites that could potentially receive shadow and require Tier 3 analysis"
    },
    "sites_eliminated": {
      "type": "geojson",
      "description": "Sensitive sites ruled out by Tier 2 directional screen"
    },
    "no_shadow_zone": {
      "type": "geojson",
      "description": "The triangular zone south of the building that can never receive shadow"
    },
    "triggered": {
      "type": "boolean",
      "description": "True if any sensitive sites remain after Tier 2 screening (Tier 3 required)"
    },
    "summary_report": {
      "type": "text",
      "description": "Summary of Tier 2 directional screening results"
    },
    "visualization": {
      "type": "html",
      "description": "Interactive map showing building, no-shadow zone, and site classifications"
    }
  }
}
